{
  "$schema": "https://json-schema.org/draft/2020-12/schema",
  "$id": "registry/v1",
  "title": "Node type (registry/v1)",
  "type": "object",
  "additionalProperties": false,
  "required": ["type", "version", "title", "category", "inputs", "outputs", "params", "runner", "cost"],
  "properties": {
    "type": { "type": "string", "pattern": "^(input|video|audio|image|text|flow|output)\\.[a-z][a-z0-9_]*$" },
    "version": { "type": "integer", "minimum": 1 },
    "title": { "type": "string", "minLength": 1, "maxLength": 40 },
    "description": { "type": "string", "maxLength": 200 },
    "icon": { "type": "string" },
    "category": { "enum": ["input", "video", "audio", "image", "text", "flow", "output"] },
    "inputs": { "type": "array", "items": { "$ref": "#/$defs/port" } },
    "outputs": { "type": "array", "items": { "$ref": "#/$defs/port" } },
    "params": {
      "type": "object",
      "propertyNames": { "pattern": "^[a-z][a-zA-Z0-9]*$" },
      "additionalProperties": { "$ref": "#/$defs/param" }
    },
    "runner": { "$ref": "#/$defs/runner" },
    "cost": {
      "type": "object",
      "additionalProperties": false,
      "required": ["unit", "estimate"],
      "properties": {
        "unit": { "enum": ["credit_per_run", "credit_per_image", "credit_per_second", "credit_per_1k_chars"] },
        "estimate": { "type": "number", "minimum": 0 }
      }
    },
    "ui": {
      "type": "object",
      "additionalProperties": false,
      "properties": {
        "body": { "type": "string", "description": "Optional custom body component name" },
        "width": { "type": "integer", "minimum": 200, "maximum": 600 },
        "previewPort": { "type": "string" }
      }
    },
    "modes": {
      "type": "array", "minItems": 1,
      "description": "Explicit mode tabs. A port with `modes` only takes inputs in those modes",
      "items": {
        "type": "object", "additionalProperties": false, "required": ["value", "label"],
        "properties": {
          "value": { "type": "string", "pattern": "^[a-z][a-z0-9-]*$" },
          "label": { "type": "string" },
          "needs": { "enum": ["image", "video", "audio", "text"] }
        }
      }
    },
    "migrate": { "type": "string", "description": "Module path exporting (params, fromVersion) => params" },
    "agentHints": { "type": "string", "maxLength": 200 }
  },
  "$defs": {
    "kind": {
      "type": "string",
      "pattern": "^(image|video|audio|text|json|any|list<(image|video|audio|text|json)>)$"
    },
    "port": {
      "type": "object",
      "additionalProperties": false,
      "required": ["key", "kind"],
      "properties": {
        "key": { "type": "string", "pattern": "^[a-z][a-zA-Z0-9]*$" },
        "kind": {
          "oneOf": [
            { "$ref": "#/$defs/kind" },
            { "type": "array", "minItems": 2, "uniqueItems": true, "items": { "$ref": "#/$defs/kind" } }
          ]
        },
        "required": { "type": "boolean", "default": false },
        "multiple": { "type": "boolean", "default": false },
        "label": { "type": "string" },
        "max": { "type": "integer", "minimum": 1, "description": "How many inputs this role takes" },
        "modes": { "type": "array", "minItems": 1, "items": { "type": "string" }, "description": "Only in these modes; required only there" }
      }
    },
    "paramCommon": {
      "type": "object",
      "properties": {
        "label": { "type": "string" },
        "help": { "type": "string" },
        "required": { "type": "boolean" },
        "advanced": { "type": "boolean" },
        "showIf": {
          "type": "object",
          "additionalProperties": false,
          "required": ["key", "equals"],
          "properties": { "key": { "type": "string" }, "equals": {} }
        }
      }
    },
    "param": {
      "allOf": [{ "$ref": "#/$defs/paramCommon" }],
      "oneOf": [
        {
          "type": "object",
          "required": ["type", "options"],
          "properties": {
            "type": { "const": "enum" },
            "options": {
              "type": "array", "minItems": 1,
              "items": {
                "oneOf": [
                  { "type": "string" },
                  { "type": "object", "required": ["value", "label"], "properties": { "value": { "type": "string" }, "label": { "type": "string" } } }
                ]
              }
            },
            "default": { "type": "string" }
          }
        },
        {
          "type": "object",
          "required": ["type"],
          "properties": {
            "type": { "const": "number" },
            "min": { "type": "number" }, "max": { "type": "number" }, "step": { "type": "number", "exclusiveMinimum": 0 },
            "default": { "type": "number" }, "unit": { "type": "string" }
          }
        },
        {
          "type": "object",
          "required": ["type"],
          "properties": {
            "type": { "const": "string" },
            "multiline": { "type": "boolean" }, "placeholder": { "type": "string" }, "default": { "type": "string" }
          }
        },
        { "type": "object", "required": ["type"], "properties": { "type": { "const": "boolean" }, "default": { "type": "boolean" } } },
        { "type": "object", "required": ["type", "kind"], "properties": { "type": { "const": "asset" }, "kind": { "enum": ["image", "video", "audio"] } } },
        { "type": "object", "required": ["type"], "properties": { "type": { "const": "color" }, "default": { "type": "string", "pattern": "^#[0-9a-fA-F]{6}$" } } },
        { "type": "object", "required": ["type", "schema"], "properties": { "type": { "const": "json" }, "schema": { "type": "object" } } },
        { "type": "object", "required": ["type", "kind"], "properties": { "type": { "const": "model" }, "kind": { "enum": ["llm", "image", "video", "audio"] }, "default": { "type": "string" } } }
      ]
    },
    "runner": {
      "oneOf": [
        {
          "type": "object",
          "additionalProperties": false,
          "required": ["kind", "worker"],
          "properties": {
            "kind": { "const": "job" },
            "worker": { "type": "string", "pattern": "^[a-z][a-z0-9-]*$" },
            "timeoutSec": { "type": "integer", "minimum": 1, "default": 300 },
            "concurrency": { "type": "integer", "minimum": 1, "default": 2 },
            "cacheable": { "type": "boolean", "default": true }
          }
        },
        {
          "type": "object",
          "additionalProperties": false,
          "required": ["kind"],
          "properties": { "kind": { "const": "flow" } }
        }
      ]
    }
  }
}
