{
  "type": "image.generate", "version": 2, "title": "Generate image", "category": "image",
  "description": "Makes images from a prompt, reference images and source images to edit.",
  "inputs": [
    { "key": "prompt", "kind": "text", "multiple": true, "label": "Prompt" },
    { "key": "reference", "kind": "image", "multiple": true, "label": "Reference" },
    { "key": "source", "kind": "image", "multiple": true, "label": "Source" }
  ],
  "outputs": [{ "key": "image", "kind": "list<image>" }],
  "params": {
    "model": { "type": "model", "kind": "image", "default": "auto", "label": "Model" },
    "prompt": { "type": "string", "multiline": true, "label": "Prompt", "placeholder": "Describe the image. Type @ to use an input" },
    "autoPrompt": { "type": "boolean", "default": true, "label": "Auto prompt", "help": "An LLM rewrites the prompt for the model before generating", "advanced": true }
  },
  "runner": { "kind": "job", "worker": "image-gen", "timeoutSec": 600, "concurrency": 4, "cacheable": true },
  "cost": { "unit": "credit_per_image", "estimate": 1 },
  "ui": { "previewPort": "image" },
  "migrate": "contracts/migrate.ts",
  "agentHints": "First step of most visual flows. Use reference images to keep a character consistent."
}
